doi,title,year,container,authors,URL,source
10.1016/j.erss.2022.102802,Challenging perceptions of socio-cultural rejection of a taboo technology: Narratives of imagined transitions to domestic toilet-linked biogas in India,2022,Energy Research &amp; Social Science,Natalie Boyd Williams; Richard S. Quilliam; Ben Campbell; Debadayita Raha; Debendra Chandra Baruah; Michèle L. Clarke; Rahul Sarma; Charmi Haque; Tonaya Borah; Jennifer Dickie,https://doi.org/10.1016/j.erss.2022.102802,crossref
10.1016/j.erss.2023.103050,Energy distributive injustices: Assessing the demographics of communities surrounding renewable and fossil fuel power plants in the United States,2023,Energy Research &amp; Social Science,Zana Cranmer; Laurel Steinfield; Javier Miranda; Taryn Stohler,https://doi.org/10.1016/j.erss.2023.103050,crossref
10.1016/j.erss.2023.103130,Breaking the cycle of corruption in Nigeria's electricity sector: Off-grid solutions for local enterprises,2023,Energy Research &amp; Social Science,Pallavi Roy; Mitchell Watkins; Chijioke Kelechi Iwuamadi; Jibrin Ibrahim,https://doi.org/10.1016/j.erss.2023.103130,crossref
10.1016/j.erss.2023.103214,Six principles to guide large-scale carbon capture and storage development,2023,Energy Research &amp; Social Science,David C. Rode; Jeffrey J. Anderson; Haibo Zhai; Paul S. Fischbeck,https://doi.org/10.1016/j.erss.2023.103214,crossref
10.1016/j.esr.2022.100821,Benefits of cross-border citizen energy communities at distribution system level,2022,Energy Strategy Reviews,Andreas Stroink; Lea Diestelmeier; Johann L. Hurink; Tim Wawer,https://doi.org/10.1016/j.esr.2022.100821,crossref
10.1016/j.esr.2024.101423,"Macroeconomic, energy, and emission effects of solar PV deployment at utility and distributed scales in Saudi Arabia",2024,Energy Strategy Reviews,Amro M. Elshurafa; Fakhri J. Hasanov; Lester C. Hunt,https://doi.org/10.1016/j.esr.2024.101423,crossref
10.1016/j.esr.2025.101731,Measuring the impacts of Saudi Arabia's energy diversification strategy: A review,2025,Energy Strategy Reviews,Khalid Amin Alnemeiri; Guillermo Iglesias Gómez; Fernando DeLlano-Paz,https://doi.org/10.1016/j.esr.2025.101731,crossref
10.1016/j.est.2018.10.025,Economic dispatch of energy storage systems in dc microgrids employing a semidefinite programming model,2019,Journal of Energy Storage,Walter Gil-González; Oscar Danilo Montoya; Erika Holguín; Alejandro Garces; Luis Fernando Grisales-Noreña,https://doi.org/10.1016/j.est.2018.10.025,crossref
10.1016/j.est.2020.102022,The role of energy storage and demand response as energy democracy policies in the energy productivity of hybrid hub system considering social inconvenience cost,2021,Journal of Energy Storage,Sobhan Dorahaki; Amir Abdollahi; Masoud Rashidinejad; Mohammadamin Moghbeli,https://doi.org/10.1016/j.est.2020.102022,crossref
10.1016/j.est.2022.106160,"Multi-objective planning of energy hub on economic aspects and resources with heat and power sources, energizable, electric vehicle and hydrogen storage system due to uncertainties and demand response",2023,Journal of Energy Storage,Guodao Zhang; Yisu Ge; Zi Ye; Mohammed Al-Bahrani,https://doi.org/10.1016/j.est.2022.106160,crossref
10.1016/j.est.2024.112708,Comparison of different optimization techniques applied to optimal operation of energy storage systems in standalone and grid-connected direct current microgrids,2024,Journal of Energy Storage,Jhon Montano; Juan Pablo Guzmán-Rodríguez; Jose Mena Palomeque; Daniel González-Montoya,https://doi.org/10.1016/j.est.2024.112708,crossref
10.1016/j.est.2024.113913,DC microgrid operation with hybrid energy storage considering islanding constraints and demand response coordination: A bi-level Stackelberg game approach,2024,Journal of Energy Storage,Abhishek Singh; Alok Kumar; Chinmaya K.A.; Avirup Maulik,https://doi.org/10.1016/j.est.2024.113913,crossref
10.1016/j.est.2025.116715,An adaptive bi-level optimization model for market integration of community energy storage in local trading and upstream energy and regulation services,2025,Journal of Energy Storage,Sobhan Dorahaki; Nima Amjady; S.M. Muyeen,https://doi.org/10.1016/j.est.2025.116715,crossref
10.1016/j.geoforum.2018.11.017,Cotton certification in Ethiopia: Can an increasing demand for certified textiles create a ‘fashion revolution’?,2019,Geoforum,Lena Partzsch; Laura Kemper,https://doi.org/10.1016/j.geoforum.2018.11.017,crossref
10.1016/j.geoforum.2019.04.015,"Competing claims over access to land in Rwanda: Legal pluralism, power and subjectivities",2020,Geoforum,Aymar Nyenyezi Bisoka; Cécile Giraud; An Ansoms,https://doi.org/10.1016/j.geoforum.2019.04.015,crossref
10.1016/j.geoforum.2023.103721,Digital transformation in the world city networks’ advanced producer services complex: A technology space analysis,2024,Geoforum,Francisco Trincado-Munoz; Michiel van Meeteren; Tzameret H. Rubin; Tim Vorley,https://doi.org/10.1016/j.geoforum.2023.103721,crossref
10.1016/j.gr.2023.10.016,"Impact of environmental taxation, green innovation, economic growth, and renewable energy on green total factor productivity",2025,Gondwana Research,Yi Sun; Samira Ben Belgacem; Ghousia Khatoon; Fahad Nazir,https://doi.org/10.1016/j.gr.2023.10.016,crossref
10.1016/j.habitatint.2020.102264,Measuring the spatial hierarchical urban system in China in reference to the Central Place Theory,2020,Habitat International,Lifeng Shi; Michael Wurm; Xianjin Huang; Taiyang Zhong; Hannes Taubenböck,https://doi.org/10.1016/j.habitatint.2020.102264,crossref
10.1016/j.ijepes.2019.105378,A smart community energy management scheme considering user dominated demand side response and P2P trading,2020,International Journal of Electrical Power &amp; Energy Systems,Suyang Zhou; Fenghua Zou; Zhi Wu; Wei Gu; Qiteng Hong; Campbell Booth,https://doi.org/10.1016/j.ijepes.2019.105378,crossref
10.1016/j.ijepes.2021.107243,Peer-to-peer multi-energy sharing for home microgrids: An integration of data-driven and model-driven approaches,2021,International Journal of Electrical Power &amp; Energy Systems,Longxi Li; Sen Zhang,https://doi.org/10.1016/j.ijepes.2021.107243,crossref
10.1016/j.ijepes.2024.110368,Assessing customer-side demand response identification for optimal scheduling considering satisfaction level for microgrids,2025,International Journal of Electrical Power &amp; Energy Systems,Xidong Zheng; Feifei Bai; Tao Jin,https://doi.org/10.1016/j.ijepes.2024.110368,crossref
10.1016/j.ijhydene.2009.09.009,High-temperature electrolysis for large-scale hydrogen and syngas production from nuclear energy – summary of system simulation and economic analyses,2010,International Journal of Hydrogen Energy,J.E. O'Brien; M.G. McKellar; E.A. Harvego; C.M. Stoots,https://doi.org/10.1016/j.ijhydene.2009.09.009,crossref
10.1016/j.ijhydene.2018.10.043,Hierarchical energy management control for islanding DC microgrid with electric-hydrogen hybrid storage system,2019,International Journal of Hydrogen Energy,Yuchen Pu; Qi Li; Weirong Chen; Hong Liu,https://doi.org/10.1016/j.ijhydene.2018.10.043,crossref
10.1016/j.ijhydene.2024.12.500,"An IGDT optimization model for a prosumer-oriented citizen energy community considering hydrogen parking lots, energy sharing and thermal comfort",2025,International Journal of Hydrogen Energy,Homayoun Ghasemnejad; Sobhan Dorahaki; Masoud Rashidinejad; S.M. Muyeen,https://doi.org/10.1016/j.ijhydene.2024.12.500,crossref
10.1016/j.ijproman.2020.08.002,Project initiation as the beginning of the end: Mediating temporal tensions in school's health projects,2020,International Journal of Project Management,Erik Söderberg,https://doi.org/10.1016/j.ijproman.2020.08.002,crossref
10.1016/j.iref.2022.05.008,The impact of information communication technology on energy demand: Some international evidence,2022,International Review of Economics &amp; Finance,En-Ze Wang; Chien-Chiang Lee,https://doi.org/10.1016/j.iref.2022.05.008,crossref
10.1016/j.jclepro.2015.11.070,How do firms consider non-energy benefits? Empirical findings on energy-efficiency investments in Swedish industry,2016,Journal of Cleaner Production,Therese Nehler; Josefine Rasmussen,https://doi.org/10.1016/j.jclepro.2015.11.070,crossref
10.1016/j.jclepro.2018.06.271,Energy management of smart micro-grid with response loads and distributed generation considering demand response,2018,Journal of Cleaner Production,Yongli Wang; Yujing Huang; Yudong Wang; Ming Zeng; Fang Li; Yunlu Wang; Yuangyuan Zhang,https://doi.org/10.1016/j.jclepro.2018.06.271,crossref
10.1016/j.jclepro.2018.10.196,A screening methodology for building multiple energy retrofit measures package considering economic and risk aspects,2019,Journal of Cleaner Production,Donglin Zheng; Lijun Yu; Lizhen Wang; Jiangang Tao,https://doi.org/10.1016/j.jclepro.2018.10.196,crossref
10.1016/j.jclepro.2019.119205,Exploring the practices and roles of UK construction manufacturers and merchants in relation to housing energy retrofit,2020,Journal of Cleaner Production,Gavin Killip; Alice Owen; Marina Topouzi,https://doi.org/10.1016/j.jclepro.2019.119205,crossref
10.1016/j.jclepro.2022.135271,Peer-to-peer energy sharing with demand-side management for fair revenue distribution and stable grid interaction in the photovoltaic community,2023,Journal of Cleaner Production,Fuyou Zhao; Zhenpeng Li; Dengjia Wang; Tao Ma,https://doi.org/10.1016/j.jclepro.2022.135271,crossref
10.1016/j.jclepro.2023.136890,"The digital economy, spatial spillovers and forestry green total factor productivity",2023,Journal of Cleaner Production,Chen Chen; Feng Ye; Hui Xiao; Wei Xie; Bei Liu; Liqun Wang,https://doi.org/10.1016/j.jclepro.2023.136890,crossref
10.1016/j.jclepro.2025.144933,"Unveiling the impacts of climate change on the resilience of renewable energy and power systems: Factors, technological advancements, policies, challenges, and solutions",2025,Journal of Cleaner Production,Tuhibur Rahman; M.S. Hossain Lipu; Md Moinul Alom Shovon; Ibrahim Alsaduni; Tahia F. Karim; Shaheer Ansari,https://doi.org/10.1016/j.jclepro.2025.144933,crossref
10.1016/j.jclepro.2025.145603,Impacts of electricity market reforms: from the perspective of economic-energy-environment system synergies,2025,Journal of Cleaner Production,Wei Zhang; Cuie Chen; Mingjie Li,https://doi.org/10.1016/j.jclepro.2025.145603,crossref
10.1016/j.jenvman.2024.123471,Why fossil fuels stifle green economic growth? An environmental management perspective in assessing the spatial spillover impact of energy consumption in South Asia,2025,Journal of Environmental Management,Yinjia Miao; Azaz Ali Ather Bukhari; Waqar Ali Ather Bukhari; Shabbir Ahmad; Naveed Hayat,https://doi.org/10.1016/j.jenvman.2024.123471,crossref
10.1016/j.jfineco.2023.103745,"Artificial intelligence, firm growth, and product innovation",2024,Journal of Financial Economics,Tania Babina; Anastassia Fedyk; Alex He; James Hodson,https://doi.org/10.1016/j.jfineco.2023.103745,crossref
10.1016/j.joule.2022.07.011,Sources of data center energy estimates: A comprehensive review,2022,Joule,David Mytton; Masaō Ashtine,https://doi.org/10.1016/j.joule.2022.07.011,crossref
10.1016/j.joule.2023.05.010,On the origin of carbon sources in the electrochemical upgrade of CO2 from carbon capture solutions,2023,Joule,Kangze Shen; Dongfang Cheng; Eber Reyes-Lopez; Joonbaek Jang; Philippe Sautet; Carlos G. Morales-Guio,https://doi.org/10.1016/j.joule.2023.05.010,crossref
10.1016/j.joule.2023.09.004,The growing energy footprint of artificial intelligence,2023,Joule,Alex de Vries,https://doi.org/10.1016/j.joule.2023.09.004,crossref
10.1016/j.jpubeco.2013.02.004,Evaluating China's poverty alleviation program: A regression discontinuity approach,2013,Journal of Public Economics,Lingsheng Meng,https://doi.org/10.1016/j.jpubeco.2013.02.004,crossref
10.1016/j.jtrangeo.2014.01.005,Do firms flee traffic congestion?,2014,Journal of Transport Geography,Matthias N. Sweet,https://doi.org/10.1016/j.jtrangeo.2014.01.005,crossref
10.1016/j.jue.2008.08.004,Miles to go before I learn: The effect of travel distance on the mature person's choice of a community college,2009,Journal of Urban Economics,Christopher Jepsen; Mark Montgomery,https://doi.org/10.1016/j.jue.2008.08.004,crossref
10.1016/j.jue.2011.06.001,Local labor market impacts of energy boom-bust-boom in Western Canada,2012,Journal of Urban Economics,Joseph Marchand,https://doi.org/10.1016/j.jue.2011.06.001,crossref
10.1016/j.patter.2021.100340,"The real climate and transformative impact of ICT: A critique of estimates, trends, and regulations",2021,Patterns,Charlotte Freitag; Mike Berners-Lee; Kelly Widdicks; Bran Knowles; Gordon S. Blair; Adrian Friday,https://doi.org/10.1016/j.patter.2021.100340,crossref
10.1016/j.regsciurbeco.2024.103998,Cities and water quality,2024,Regional Science and Urban Economics,Rhiannon L. Jerch; Daniel J. Phaneuf,https://doi.org/10.1016/j.regsciurbeco.2024.103998,crossref
10.1016/j.renene.2017.10.017,Impact of different time series aggregation methods on optimal energy system design,2018,Renewable Energy,Leander Kotzur; Peter Markewitz; Martin Robinius; Detlef Stolten,https://doi.org/10.1016/j.renene.2017.10.017,crossref
10.1016/j.renene.2020.09.016,Toward blockchain-based renewable energy microgrid design considering default risk and demand uncertainty,2021,Renewable Energy,Yu-Chung Tsao; Vo-Van Thanh,https://doi.org/10.1016/j.renene.2020.09.016,crossref
10.1016/j.renene.2023.119654,Using solar microreactors and photocatalysts to synthesize biodiesel,2024,Renewable Energy,Babak Aghel; Arash Biabani,https://doi.org/10.1016/j.renene.2023.119654,crossref
10.1016/j.renene.2023.119830,Investment in renewable energy and green financing and their role in achieving carbon-neutrality and economic sustainability: Insights from Asian region,2024,Renewable Energy,Lingli Qing; Jawad Abbas; Hina Najam; Xiang Ma; Abd Alwahed Dagestani,https://doi.org/10.1016/j.renene.2023.119830,crossref
10.1016/j.resconrec.2020.104967,Analysis of energy efficiency improvement and carbon dioxide abatement potentials for Swiss Food and Beverage sector,2020,"Resources, Conservation and Recycling",Navdeep Bhadbhade; Martin K. Patel,https://doi.org/10.1016/j.resconrec.2020.104967,crossref
10.1016/j.resconrec.2020.105389,The overlooked environmental footprint of increasing Internet use,2021,"Resources, Conservation and Recycling",Renee Obringer; Benjamin Rachunok; Debora Maia-Silva; Maryam Arbabzadeh; Roshanak Nateghi; Kaveh Madani,https://doi.org/10.1016/j.resconrec.2020.105389,crossref
10.1016/j.resourpol.2013.11.003,The paths to social licence to operate: An integrative model explaining community acceptance of mining,2014,Resources Policy,Kieren Moffat; Airong Zhang,https://doi.org/10.1016/j.resourpol.2013.11.003,crossref
10.1016/j.resourpol.2023.103631,"Transition towards sustainable energy: The role of economic complexity, financial liberalization and natural resources management in China",2023,Resources Policy,Xiaoyi Wang; Guanqun Chen; Sahar Afshan; Abraham Ayobamiji Awosusi; Shujaat Abbas,https://doi.org/10.1016/j.resourpol.2023.103631,crossref
10.1016/j.resourpol.2023.104035,A comparative study of renewable and fossil fuels energy impacts on green development in Asian countries with divergent income inequality,2023,Resources Policy,Jiaqi Xu; Jingfeng Zhao; Wen Liu,https://doi.org/10.1016/j.resourpol.2023.104035,crossref
10.1016/j.respol.2019.03.010,Is this time different? How digitalization influences job creation and destruction,2019,Research Policy,Benjamin Balsmeier; Martin Woerter,https://doi.org/10.1016/j.respol.2019.03.010,crossref
10.1016/j.ribaf.2017.04.026,The impacts of risk-taking behaviour and competition on technical efficiency: Evidence from the Chinese banking industry,2017,Research in International Business and Finance,Yong Tan; John Anchor,https://doi.org/10.1016/j.ribaf.2017.04.026,crossref
10.1016/j.rser.2011.02.027,Quantification and monetization of employment benefits associated with renewable energy technologies in Greece,2011,Renewable and Sustainable Energy Reviews,C. Tourkolias; S. Mirasgedis,https://doi.org/10.1016/j.rser.2011.02.027,crossref
10.1016/j.rser.2012.09.019,Demand response in smart electricity grids equipped with renewable energy sources: A review,2013,Renewable and Sustainable Energy Reviews,Jamshid Aghaei; Mohammad-Iman Alizadeh,https://doi.org/10.1016/j.rser.2012.09.019,crossref
10.1016/j.rser.2013.12.007,"A review of data center cooling technology, operating conditions and the corresponding low-grade waste heat recovery opportunities",2014,Renewable and Sustainable Energy Reviews,Khosrow Ebrahimi; Gerard F. Jones; Amy S. Fleischer,https://doi.org/10.1016/j.rser.2013.12.007,crossref
10.1016/j.rser.2014.07.010,A field study on thermal comfort in naturally-ventilated buildings located in the equatorial climatic region of Cameroon,2014,Renewable and Sustainable Energy Reviews,Modeste Kameni Nematchoua; René Tchinda; Paola Ricciardi; Noël Djongyang,https://doi.org/10.1016/j.rser.2014.07.010,crossref
10.1016/j.rser.2016.06.008,Managing electric flexibility from Distributed Energy Resources: A review of incentives for market design,2016,Renewable and Sustainable Energy Reviews,Cherrelle Eid; Paul Codani; Yannick Perez; Javier Reneses; Rudi Hakvoort,https://doi.org/10.1016/j.rser.2016.06.008,crossref
10.1016/j.rser.2016.12.002,Energy efficiency policy evaluation by moving from techno-economic towards whole society perspective on energy efficiency market,2017,Renewable and Sustainable Energy Reviews,Vesna Bukarica; Željko Tomšić,https://doi.org/10.1016/j.rser.2016.12.002,crossref
10.1016/j.rser.2017.10.103,What makes consumers adopt to innovative energy services in the energy market? A review of incentives and barriers,2018,Renewable and Sustainable Energy Reviews,Anna Kowalska-Pyzalska,https://doi.org/10.1016/j.rser.2017.10.103,crossref
10.1016/j.rser.2018.05.037,Energy end-use and efficiency potentials among Swedish industrial small and medium-sized enterprises – A dataset analysis from the national energy audit program,2018,Renewable and Sustainable Energy Reviews,Elias Andersson; Magnus Karlsson; Patrik Thollander; Svetlana Paramonova,https://doi.org/10.1016/j.rser.2018.05.037,crossref
10.1016/j.rser.2018.06.017,Demand Response Modeling in Microgrid Operation: a Review and Application for Incentive-Based and Time-Based Programs,2018,Renewable and Sustainable Energy Reviews,Mahmood Hosseini Imani; M. Jabbari Ghadi; Sahand Ghavidel; Li Li,https://doi.org/10.1016/j.rser.2018.06.017,crossref
10.1016/j.rser.2018.09.045,Large-scale grid integration of residential thermal energy storages as demand-side flexibility resource: A review of international field studies,2019,Renewable and Sustainable Energy Reviews,Peter Kohlhepp; Hassan Harb; Henryk Wolisz; Simon Waczowicz; Dirk Müller; Veit Hagenmeyer,https://doi.org/10.1016/j.rser.2018.09.045,crossref
10.1016/j.rser.2019.109249,Exploring the impact space of different technologies using a portfolio constraint based approach for multi-objective optimization of integrated urban energy systems,2019,Renewable and Sustainable Energy Reviews,Rui Jing; Kamal Kuriyan; Qingyuan Kong; Zhihui Zhang; Nilay Shah; Ning Li; Yingru Zhao,https://doi.org/10.1016/j.rser.2019.109249,crossref
10.1016/j.rser.2019.109593,Learning occupants’ indoor comfort temperature through a Bayesian inference approach for office buildings in United States,2020,Renewable and Sustainable Energy Reviews,Zhe Wang; Tianzhen Hong,https://doi.org/10.1016/j.rser.2019.109593,crossref
10.1016/j.rser.2020.110366,"Evolution of price policy for offshore wind energy in China: Trilemma of capacity, price and subsidy",2021,Renewable and Sustainable Energy Reviews,Youzhou Wei; Qing-Ping Zou; Xianghong Lin,https://doi.org/10.1016/j.rser.2020.110366,crossref
10.1016/j.rser.2023.113379,Model-data-event based community integrated energy system low-carbon economic scheduling,2023,Renewable and Sustainable Energy Reviews,Lin Xue; Jianxue Wang; Yao Zhang; Weizhen Yong; Jie Qi; Haotian Li,https://doi.org/10.1016/j.rser.2023.113379,crossref
10.1016/j.rser.2023.113438,The potential strategy of promoting China's participation in arctic energy development,2023,Renewable and Sustainable Energy Reviews,Yang Liu; Zhaoyang Kong; Qingzhe Jiang; Xiucheng Dong,https://doi.org/10.1016/j.rser.2023.113438,crossref
10.1016/j.rser.2023.114050,What maintains low-carbon consumption behaviors: Evidence from China,2024,Renewable and Sustainable Energy Reviews,Xiu Cheng; Fan Wu; Wenbo Li; Jiameng Yang; Ruyin Long,https://doi.org/10.1016/j.rser.2023.114050,crossref
10.1016/j.rser.2024.114350,A sustainable development benchmarking framework for energy companies based on topic mining and knowledge graph: The case of oil and gas industry,2024,Renewable and Sustainable Energy Reviews,Xiaofeng Xu; Zhiting Liu; Wenzhi Liu; Chuantao Pei; Xiangfan Wu; Zhengya Nie,https://doi.org/10.1016/j.rser.2024.114350,crossref
10.1016/j.scs.2022.103987,A map matching-based method for electric vehicle charging station placement at directional road segment level,2022,Sustainable Cities and Society,Zhoulin Yu; Zhouhao Wu; Qihui Li; Qiang Bai,https://doi.org/10.1016/j.scs.2022.103987,crossref
10.1016/j.scs.2022.104019,"Optimal energy management of cooperative energy communities considering flexible demand, storage and vehicle-to-grid under uncertainties",2022,Sustainable Cities and Society,Marcos Tostado-Véliz; Salah Kamel; Hany M. Hasanien; Rania A. Turky; Francisco Jurado,https://doi.org/10.1016/j.scs.2022.104019,crossref
10.1016/j.scs.2022.104267,Assessing the impacts of urban morphology factors on the energy performance for building stocks based on a novel automatic generation framework,2022,Sustainable Cities and Society,Meng Wang; Hang Yu; Yikun Yang; Rui Jing; Yin Tang; Chaoen Li,https://doi.org/10.1016/j.scs.2022.104267,crossref
10.1016/j.scs.2023.104498,Mapping seasonal changes of street greenery using multi-temporal street-view images,2023,Sustainable Cities and Society,Yuqi Han; Teng Zhong; Anthony G.O. Yeh; Xiuming Zhong; Min Chen; Guonian Lü,https://doi.org/10.1016/j.scs.2023.104498,crossref
10.1016/j.scs.2023.105028,Coordinated design of multi-stakeholder community energy systems and shared energy storage under uncertain supply and demand: A game theoretical approach,2024,Sustainable Cities and Society,Longxi Li; Kequn Peng; Xiaohui Yang; Ke Liu,https://doi.org/10.1016/j.scs.2023.105028,crossref
10.1016/j.segan.2021.100542,A Peer-to-Peer energy trading market model based on time-driven prospect theory in a smart and sustainable energy community,2021,"Sustainable Energy, Grids and Networks",Sobhan Dorahaki; Masoud Rashidinejad; Seyed Farshad Fatemi Ardestani; Amir Abdollahi; Mohammad Reza Salehizadeh,https://doi.org/10.1016/j.segan.2021.100542,crossref
10.1016/j.seta.2021.101694,Techno-economic-environmental impacts of industrial energy assessment: Sustainable industrial motor systems of small and medium-sized enterprises,2022,Sustainable Energy Technologies and Assessments,Angelica Errigo; Jun-Ki Choi; Kelly Kissock,https://doi.org/10.1016/j.seta.2021.101694,crossref
10.1016/j.techsoc.2022.102161,Does smart city implementation improve the subjective quality of life? Evidence from China,2023,Technology in Society,Mengmeng Wang; Tao Zhou,https://doi.org/10.1016/j.techsoc.2022.102161,crossref
10.1016/j.tej.2023.107255,Will allowed returns for regulated utilities keep up with inflation?,2023,The Electricity Journal,Kurt Strunk; Ibrahim Ouf; Ben Schneider,https://doi.org/10.1016/j.tej.2023.107255,crossref
10.1016/j.tele.2016.08.004,The effects of cultural dimension on ICT innovation: Empirical analysis of mobile phone services,2017,Telematics and Informatics,Felix Olu Bankole; Omolola Ola Bankole,https://doi.org/10.1016/j.tele.2016.08.004,crossref
10.1016/j.tele.2021.101604,The politics of new driving technologies: Political ideology and autonomous vehicle adoption,2021,Telematics and Informatics,Elizabeth A. Mack; Steven R. Miller; Chu-Hsiang Chang; Jenna A. Van Fossen; Shelia R. Cotten; Peter T. Savolainen; John Mann,https://doi.org/10.1016/j.tele.2021.101604,crossref
10.1016/j.xcrp.2023.101601,Ultrafast microscopy and image segmentation of spatially heterogeneous excited state and trap passivation in Cu2BaSnSSe3,2023,Cell Reports Physical Science,Hannah Luebbering; Ashkan Shafiee; Betul Teymur; Yongshin Kim; David B. Mitzi; Elham Ghadiri,https://doi.org/10.1016/j.xcrp.2023.101601,crossref
10.1016/s0959-6526(01)00035-x,Do agreements enhance energy efficiency improvement?,2002,Journal of Cleaner Production,Martijn G. Rietbergen; Jacco C.M. Farla; Kornelis Blok,https://doi.org/10.1016/s0959-6526(01)00035-x,crossref
10.1017/cbo9780511626982,Input-Output Analysis,2009,,Ronald E. Miller; Peter D. Blair,https://doi.org/10.1017/cbo9780511626982,crossref
10.1038/d41586-018-06610-y,How to stop data centres from gobbling up the world’s electricity,2018,Nature,Nicola Jones,https://doi.org/10.1038/d41586-018-06610-y,crossref
10.1038/nenergy.2017.1,The impacts of storing solar energy in the home to reduce reliance on the utility,2017,Nature Energy,Robert L. Fares; Michael E. Webber,https://doi.org/10.1038/nenergy.2017.1,crossref
10.1038/s41545-021-00101-w,Data centre water consumption,2021,npj Clean Water,David Mytton,https://doi.org/10.1038/s41545-021-00101-w,crossref
10.1038/s41545-022-00187-w,Pyridinic N anchored Ag and Au hybrids for detoxification of organic pollutants,2022,npj Clean Water,Naveen Kumar Reddy Bogireddy; Abdel Ghafour El Hachimi; Yetzin Rodriguez Mejia; Mohan Kumar Kesarla; Rajender S. Varma; Raul Herrera Becerra; Vivechana Agarwal,https://doi.org/10.1038/s41545-022-00187-w,crossref
