doi,title,year,container,authors,URL,source
10.1038/s41560-020-0558-0,Quantifying the impacts of climate change and extreme climate events on energy systems,2020,Nature Energy,A. T. D. Perera; Vahid M. Nik; Deliang Chen; Jean-Louis Scartezzini; Tianzhen Hong,https://doi.org/10.1038/s41560-020-0558-0,crossref
10.1038/s41560-020-0641-6,The justice and equity implications of the clean energy transition,2020,Nature Energy,Sanya Carley; David M. Konisky,https://doi.org/10.1038/s41560-020-0641-6,crossref
10.1038/s41560-020-0664-z,Impacts of climate change on energy systems in global and regional scenarios,2020,Nature Energy,Seleshi G. Yalew; Michelle T. H. van Vliet; David E. H. J. Gernaat; Fulco Ludwig; Ariel Miara; Chan Park; Edward Byers; Enrica De Cian; Franziska Piontek; Gokul Iyer; Ioanna Mouratiadou; James Glynn; Mohamad Hejazi; Olivier Dessens; Pedro Rochedo; Robert Pietzcker; Roberto Schaeffer; Shinichiro Fujimori; Shouro Dasgupta; Silvana Mima; Silvia R. Santos da Silva; Vaibhav Chaturvedi; Robert Vautard; Detlef P. van Vuuren,https://doi.org/10.1038/s41560-020-0664-z,crossref
10.1038/s41560-023-01304-w,Climate change impacts on planned supply–demand match in global wind and solar energy systems,2023,Nature Energy,Laibao Liu; Gang He; Mengxi Wu; Gang Liu; Haoran Zhang; Ying Chen; Jiashu Shen; Shuangcheng Li,https://doi.org/10.1038/s41560-023-01304-w,crossref
10.1038/s41597-024-04277-x,"Global datasets of geospatial-AI-resolved energy consumers including climate-driven energy demands, geographical and socioeconomic realities for a transition reset",2024,Scientific Data,Diego Moya; Dennis Copara; Sara Giarola; Adam Hawkes,https://doi.org/10.1038/s41597-024-04277-x,crossref
10.1073/pnas.1613193114,Climate change is projected to have severe impacts on the frequency and intensity of peak electricity demand across the United States,2017,Proceedings of the National Academy of Sciences,Maximilian Auffhammer; Patrick Baylis; Catherine H. Hausman,https://doi.org/10.1073/pnas.1613193114,crossref
10.1080/00343404.2023.2185218,What draws investment to special economic zones? Lessons from developing countries,2023,Regional Studies,Susanne A. Frick; Andrés Rodríguez-Pose,https://doi.org/10.1080/00343404.2023.2185218,crossref
10.1080/01944360408976336,The Failures of Economic Development Incentives,2004,Journal of the American Planning Association,Alan Peters; Peter Fisher,https://doi.org/10.1080/01944360408976336,crossref
10.1080/01944360903490923,Community Benefits Agreements and Local Government,2010,Journal of the American Planning Association,Laura Wolf-Powers,https://doi.org/10.1080/01944360903490923,crossref
10.1080/14786451.2019.1700261,The impact of renewable and non-renewable energy consumption on economic growth: the case of Greece,2019,International Journal of Sustainable Energy,Panagiotis Pegkas,https://doi.org/10.1080/14786451.2019.1700261,crossref
10.1080/15567249.2020.1868619,Spatial Energy Efficiency Patterns in New York and Implications for Energy Demand and the Rebound Effect,2021,"Energy Sources, Part B: Economics, Planning, and Policy",Joseph Nyangon; John Byrne,https://doi.org/10.1080/15567249.2020.1868619,crossref
10.1086/259584,The Effects of Property Taxes and Local Public Spending on Property Values: An Empirical Study of Tax Capitalization and the Tiebout Hypothesis,1969,Journal of Political Economy,Wallace E. Oates,https://doi.org/10.1086/259584,crossref
10.1086/652254,"Diane Mason. The Secret Vice: Masturbation in Victorian Fiction and Medical Culture. Manchester: Manchester University Press, 2008. Pp. viii+184. $79.00 (cloth).",2010,Journal of British Studies,Charles Upchurch,https://doi.org/10.1086/652254,crossref
10.1086/705716,Robots and Jobs: Evidence from US Labor Markets,2020,Journal of Political Economy,Daron Acemoglu; Pascual Restrepo,https://doi.org/10.1086/705716,crossref
10.1088/1748-9326/abfba1,The environmental footprint of data centers in the United States,2021,Environmental Research Letters,Md Abu Bakar Siddik; Arman Shehabi; Landon Marston,https://doi.org/10.1088/1748-9326/abfba1,crossref
10.1093/cjres/rsr028,"The American scenescape: amenities, scenes and the qualities of local life",2011,"Cambridge Journal of Regions, Economy and Society",D. Silver,https://doi.org/10.1093/cjres/rsr028,crossref
10.1093/jeg/lbae001,Inter-organizational governance and innovation under different local institutional contexts,2024,Journal of Economic Geography,Jose Antonio Belso-Martinez; Isabel Díez-Vial; Andrés Rodríguez-Pose,https://doi.org/10.1093/jeg/lbae001,crossref
10.1093/jeg/lby016,"Money and Finance After the Crisis. Critical Thinking for Uncertain Times Brett Christophers, Andrew Leyshon and Geoff Mann",2018,Journal of Economic Geography,Sabine Dörry,https://doi.org/10.1093/jeg/lby016,crossref
10.1093/oxfordjournals.oep.a041643,"BOOMING SECTOR AND DUTCH DISEASE ECONOMICS: SURVEY AND CONSOLIDATION
            
              *",1984,Oxford Economic Papers,W. M. CORDEN,https://doi.org/10.1093/oxfordjournals.oep.a041643,crossref
10.1093/qje/qjt034,"Local Economic Development, Agglomeration Economies, and the Big Push: 100 Years of Evidence from the Tennessee Valley Authority *",2013,The Quarterly Journal of Economics,Patrick Kline; Enrico Moretti,https://doi.org/10.1093/qje/qjt034,crossref
10.1093/restud/rdy042,Strategy-proofness in the Large,2018,The Review of Economic Studies,Eduardo M Azevedo; Eric Budish,https://doi.org/10.1093/restud/rdy042,crossref
10.1108/09699981111145817,The politics of sameness in the Australian construction industry,2011,"Engineering, Construction and Architectural Management",Martin Loosemore; Florence T.T. Phua; Kevin Dunn; Umut Ozguc,https://doi.org/10.1108/09699981111145817,crossref
10.1109/access.2022.3140587,Analysis of Microgrid’s Operation Integrated to Renewable Energy and Electric Vehicles in View of Multiple Demand Response Programs,2022,IEEE Access,Habib Ur Rahman Habib; Asad Waqar; Mohamed G. Hussien; Abdul Khalique Junejo; Mehdi Jahangiri; Rasool M. Imran; Yun-Su Kim; Jun-Hyeok Kim,https://doi.org/10.1109/access.2022.3140587,crossref
10.1109/access.2024.3481155,A Stackelberg Game Theory Model for Integrated Community Energy Storage Systems,2024,IEEE Access,Sobhan Dorahaki; S. M. Muyeen; Nima Amjady,https://doi.org/10.1109/access.2024.3481155,crossref
10.1109/access.2024.3514698,Hybrid Multi-Criteria Decision Framework for Prosumers Energy Storage Systems in Smart Grids,2024,IEEE Access,Marriam Liaqat; Muhammad Adnan; Mohaira Ahmad; Muhammad Sajid Iqbal; Faizan Ahmad; Sami Ud Din,https://doi.org/10.1109/access.2024.3514698,crossref
10.1109/comst.2015.2481183,Data Center Energy Consumption Modeling: A Survey,2016,IEEE Communications Surveys &amp; Tutorials,Miyuru Dayarathna; Yonggang Wen; Rui Fan,https://doi.org/10.1109/comst.2015.2481183,crossref
10.1109/itherm.2004.1319156,Thickness measurements of the thin film in spray evaporative cooling,,The Ninth Intersociety Conference on Thermal and Thermomechanical Phenomena In Electronic Systems (IEEE Cat. No.04CH37543),A.G. Pautsch; T.A. Shedd; G.F. Nellis,https://doi.org/10.1109/itherm.2004.1319156,crossref
10.1109/mc.2022.3148714,"The Carbon Footprint of Machine Learning Training Will Plateau, Then Shrink",2022,Computer,David Patterson; Joseph Gonzalez; Urs Holzle; Quoc Le; Chen Liang; Lluis-Miquel Munguia; Daniel Rothchild; David R. So; Maud Texier; Jeff Dean,https://doi.org/10.1109/mc.2022.3148714,crossref
10.1109/stherm.2012.6188851,Server liquid cooling with chiller-less data center design to enable significant energy savings,2012,2012 28th Annual IEEE Semiconductor Thermal Measurement and Management Symposium (SEMI-THERM),Madhusudan Iyengar; Milnes David; Pritish Parida; Vinod Kamath; Bejoy Kochuparambil; David Graybill; Mark Schultz; Michael Gaynes; Robert Simons; Roger Schmidt; Timothy Chainer,https://doi.org/10.1109/stherm.2012.6188851,crossref
10.1109/tia.2022.3152140,Economic Planning and Comparative Analysis of Market-Driven Multi-Microgrid System for Peer-to-Peer Energy Trading,2022,IEEE Transactions on Industry Applications,Liaqat Ali; S. M. Muyeen; Hamed Bizhani; Marcelo G. Simoes,https://doi.org/10.1109/tia.2022.3152140,crossref
10.1109/tie.2012.2196889,"Advanced Control Architectures for Intelligent Microgrids—Part II: Power Quality, Energy Storage, and AC/DC Microgrids",2013,IEEE Transactions on Industrial Electronics,Josep M. Guerrero; Poh Chiang Loh; Tzung-Lin Lee; Mukul Chandorkar,https://doi.org/10.1109/tie.2012.2196889,crossref
10.1109/tie.2014.2387340,Distributed Energy Trading in Microgrids: A Game-Theoretic Model and Its Equilibrium Analysis,2015,IEEE Transactions on Industrial Electronics,Joohyung Lee; Jun Guo; Jun Kyun Choi; Moshe Zukerman,https://doi.org/10.1109/tie.2014.2387340,crossref
10.1109/tie.2015.2412524,Optimal Economical Schedule of Hydrogen-Based Microgrids With Hybrid Storage Using Model Predictive Control,2015,IEEE Transactions on Industrial Electronics,Felix Garcia-Torres; Carlos Bordons,https://doi.org/10.1109/tie.2015.2412524,crossref
10.1109/tie.2018.2874578,Peer-to-Peer Energy Trading in a Prosumer-Based Community Microgrid: A Game-Theoretic Model,2019,IEEE Transactions on Industrial Electronics,Amrit Paudel; Kalpesh Chaudhari; Chao Long; Hoay Beng Gooi,https://doi.org/10.1109/tie.2018.2874578,crossref
10.1109/tpwrs.2017.2649558,Energy-Sharing Model With Price-Based Demand Response for Microgrids of Peer-to-Peer Prosumers,2017,IEEE Transactions on Power Systems,Nian Liu; Xinghuo Yu; Cheng Wang; Chaojie Li; Li Ma; Jinyong Lei,https://doi.org/10.1109/tpwrs.2017.2649558,crossref
10.1109/tpwrs.2018.2806879,Simultaneous Procurement of Demand Response Provisions in Energy and Spinning Reserve Markets,2018,IEEE Transactions on Power Systems,Nitin Padmanabhan; Mohamed Ahmed; Kankar Bhattacharya,https://doi.org/10.1109/tpwrs.2018.2806879,crossref
10.1109/tsg.2014.2346024,Risk-Constrained Profit Maximization for Microgrid Aggregators With Demand Response,2015,IEEE Transactions on Smart Grid,Duong Tung Nguyen; Long Bao Le,https://doi.org/10.1109/tsg.2014.2346024,crossref
10.1109/tsg.2020.2980318,Demand-Side Management With Shared Energy Storage System in Smart Grid,2020,IEEE Transactions on Smart Grid,Jaeyeon Jo; Jinkyoo Park,https://doi.org/10.1109/tsg.2020.2980318,crossref
10.1109/tsg.2022.3147370,Distributed Robust Model Predictive Control-Based Energy Management Strategy for Islanded Multi-Microgrids Considering Uncertainty,2022,IEEE Transactions on Smart Grid,Zhuoli Zhao; Juntao Guo; Xi Luo; Chun Sing Lai; Ping Yang; Loi Lei Lai; Peng Li; Josep M. Guerrero; Mohammad Shahidehpour,https://doi.org/10.1109/tsg.2022.3147370,crossref
10.1109/tsg.2023.3246083,A Dynamic Peer-to-Peer Electricity Market Model for a Community Microgrid With Price-Based Demand Response,2023,IEEE Transactions on Smart Grid,Fayiz Alfaverh; Mouloud Denai; Yichuang Sun,https://doi.org/10.1109/tsg.2023.3246083,crossref
10.1109/tsg.2023.3279415,Incentive Compatible Pricing for Enhancing the Controllability of Price-Based Demand Response,2024,IEEE Transactions on Smart Grid,Xiaotian Sun; Haipeng Xie; Yunpeng Xiao; Zhaohong Bie,https://doi.org/10.1109/tsg.2023.3279415,crossref
10.1109/tste.2017.2743349,Evaluation of Economic Benefits of DER Aggregation,2018,IEEE Transactions on Sustainable Energy,Georgia E. Asimakopoulou; Nikos D. Hatziargyriou,https://doi.org/10.1109/tste.2017.2743349,crossref
10.1109/tste.2020.2969292,On the Trade-Off Between Environmental and Economic Objectives in Community Energy Storage Operational Optimization,2020,IEEE Transactions on Sustainable Energy,Wouter L. Schram; Tarek AlSkaif; Ioannis Lampropoulos; Sawsan Henein; Wilfried G.J.H.M. van Sark,https://doi.org/10.1109/tste.2020.2969292,crossref
10.1109/tste.2021.3110294,Data-Driven Dynamical Control for Bottom-up Energy Internet System,2022,IEEE Transactions on Sustainable Energy,Haochen Hua; Zhaoming Qin; Nanqing Dong; Yuchao Qin; Maojiao Ye; Zidong Wang; Xingying Chen; Junwei Cao,https://doi.org/10.1109/tste.2021.3110294,crossref
10.1111/1540-6229.00581,Current Issues in the Analysis of Commercial Real Estate,1992,Real Estate Economics,Jeffrey D. Fisher; R. Brian Webb,https://doi.org/10.1111/1540-6229.00581,crossref
10.1111/anti.12682,Fixing a Swamp of Cobras: The Clash between Capital and Water in Shaping Urban Vulnerabilities,2020,Antipode,Richard Friend; Khanin Hutanuwatr,https://doi.org/10.1111/anti.12682,crossref
10.1111/anti.12965,Settler Colonial Beasts: Feral Pigs and Frontier Assemblages in Texas,2023,Antipode,Jason Cons; Michael Eilenberg,https://doi.org/10.1111/anti.12965,crossref
10.1111/j.1944-8287.2002.tb00193.x,The Economic Geography of the Internet's Infrastructure*,2002,Economic Geography,Edward J. Malecki,https://doi.org/10.1111/j.1944-8287.2002.tb00193.x,crossref
10.1111/j.1944-8287.2002.tb00194.x,"Network Change, Deregulation, and Access in the Global Airline Industry*",2002,Economic Geography,John Bowen,https://doi.org/10.1111/j.1944-8287.2002.tb00194.x,crossref
10.1111/jors.12471,"World trade evolution: Growth, productivity, and employment. L. Yan Ing, M. Yu London, UK: Routledge. 472+xix. ISBN: 978‐1‐138‐48003‐2. GBP 115 (hb).",2019,Journal of Regional Science,Michiel Gerritse,https://doi.org/10.1111/jors.12471,crossref
10.1126/science.191.4227.535,Boom Towns May Hinder Energy Resource Development,1976,Science,John S. Gilmore,https://doi.org/10.1126/science.191.4227.535,crossref
10.1126/science.aba3758,Recalibrating global data center energy-use estimates,2020,Science,Eric Masanet; Arman Shehabi; Nuoa Lei; Sarah Smith; Jonathan Koomey,https://doi.org/10.1126/science.aba3758,crossref
10.1142/s1464333222500144,Economic Impacts of Carbon Tax in a General Equilibrium Framework: Empirical Study of Japan,2021,Journal of Environmental Assessment Policy and Management,Naoyuki Yoshino; Ehsan Rasoulinezhad; Farhad Taghizadeh-Hesary,https://doi.org/10.1142/s1464333222500144,crossref
10.1145/3531146.3533234,Measuring the Carbon Intensity of AI in Cloud Instances,2022,2022 ACM Conference on Fairness Accountability and Transparency,Jesse Dodge; Taylor Prewitt; Remi Tachet des Combes; Erika Odmark; Roy Schwartz; Emma Strubell; Alexandra Sasha Luccioni; Noah A. Smith; Nicole DeCario; Will Buchanan,https://doi.org/10.1145/3531146.3533234,crossref
10.1146/annurev-economics-080614-115630,The US Electricity Industry After 20 Years of Restructuring,2015,Annual Review of Economics,Severin Borenstein; James Bushnell,https://doi.org/10.1146/annurev-economics-080614-115630,crossref
10.1146/annurev.eg.19.110194.001411,Water and Energy,1994,Annual Review of Energy and the Environment,P H Gleick,https://doi.org/10.1146/annurev.eg.19.110194.001411,crossref
10.1155/etep/9877968,Intelligent Wireless Power Scheduling for Lunar Multienergy Systems: Deep Reinforcement Learning for Real‐Time Adaptive Beam Steering and Vehicle‐to‐Grid Energy Optimization,2025,International Transactions on Electrical Energy Systems,Thomas Tongxin Li; Shuangqi Li; Cynthia Xin Ding; Zhaoyao Bao; Mohannad Alhazmi,https://doi.org/10.1155/etep/9877968,crossref
10.1162/rest_a_00604,Heterogeneous Agglomeration,2017,Review of Economics and Statistics,Giulia Faggio; Olmo Silva; William C. Strange,https://doi.org/10.1162/rest_a_00604,crossref
10.1177/0042098012453856,Urban Renewal in the Inner City of Budapest: Gentrification from a Post-socialist Perspective,2012,Urban Studies,Zoltán Kovács; Reinhard Wiessner; Romy Zischner,https://doi.org/10.1177/0042098012453856,crossref
10.1177/0047287506288870,Economic Impact Studies: Instruments for Political Shenanigans?,2006,Journal of Travel Research,John L. Crompton,https://doi.org/10.1177/0047287506288870,crossref
10.1177/016001769802100102,A Review and Comparison of Shift-Share Identities,1998,International Regional Science Review,Scott Loveridge; Anne C. Selting,https://doi.org/10.1177/016001769802100102,crossref
10.1177/016001769802100301,Regional Computable General Equilibrium Modeling: A Survey and Critical Appraisal,1998,International Regional Science Review,Mark D. Partridge; Dan S. Rickman,https://doi.org/10.1177/016001769802100301,crossref
10.1177/030631284014003004,The Social Construction of Facts and Artefacts: or How the Sociology of Science and the Sociology of Technology might Benefit Each Other,1984,Social Studies of Science,Trevor J. Pinch; Wiebe E. Bijker,https://doi.org/10.1177/030631284014003004,crossref
10.1177/0309132516673241,‘The global assemblage of digital flow’,2016,Progress in Human Geography,Graham Pickren,https://doi.org/10.1177/0309132516673241,crossref
10.1177/1461444814543164,Social norms and self-presentation on social network sites: Profile work in action,2014,New Media &amp; Society,Suvi Uski; Airi Lampinen,https://doi.org/10.1177/1461444814543164,crossref
10.1177/1527476419837739,Big Data from the South(s): Beyond Data Universalism,2019,Television &amp; New Media,Stefania Milan; Emiliano Treré,https://doi.org/10.1177/1527476419837739,crossref
10.1177/2053951718820549,"When data is capital: Datafication, accumulation, and           extraction",2019,Big Data &amp; Society,Jathan Sadowski,https://doi.org/10.1177/2053951718820549,crossref
10.1186/s13705-022-00347-3,"An economic–environmental–energy efficiency analysis for optimizing organic waste treatment of a livestock-orchard system: a case in the Mekong Delta, Vietnam",2022,"Energy, Sustainability and Society",Nguyen Thi Thu Thao; Tran Thi Hieu; Nguyen Thi Phuong Thao; Le Quoc Vi; Hans Schnitzer; Le Thanh Son; Gerhart Braunegg; Sibylle Braunegg; Le Thanh Hai,https://doi.org/10.1186/s13705-022-00347-3,crossref
10.1198/jasa.2009.ap08746,Synthetic Control Methods for Comparative Case Studies: Estimating the Effect of California’s Tobacco Control Program,2010,Journal of the American Statistical Association,Alberto Abadie; Alexis Diamond; Jens Hainmueller,https://doi.org/10.1198/jasa.2009.ap08746,crossref
10.1257/aer.100.2.1,Computer Mediated Transactions,2010,American Economic Review,Hal R Varian,https://doi.org/10.1257/aer.100.2.1,crossref
10.1257/aer.100.2.373,Local Multipliers,2010,American Economic Review,Enrico Moretti,https://doi.org/10.1257/aer.100.2.373,crossref
10.1257/aer.100.3.1195,What Causes Industry Agglomeration? Evidence from Coagglomeration Patterns,2010,American Economic Review,Glenn Ellison; Edward L Glaeser; William R Kerr,https://doi.org/10.1257/aer.100.3.1195,crossref
10.1257/aer.103.5.1553,The Growth of Low-Skill Service Jobs and the Polarization of the US Labor Market,2013,American Economic Review,David H Autor; David Dorn,https://doi.org/10.1257/aer.103.5.1553,crossref
10.1257/aer.103.6.2121,The China Syndrome: Local Labor Market Effects of Import Competition in the United States,2013,American Economic Review,David H Autor; David Dorn; Gordon H Hanson,https://doi.org/10.1257/aer.103.6.2121,crossref
10.1257/aer.20161385,The Arrival of Fast Internet and Employment in Africa,2019,American Economic Review,Jonas Hjort; Jonas Poulsen,https://doi.org/10.1257/aer.20161385,crossref
10.1257/app.20180422,Healthcare Demand under Simple Prices: Evidence from Tiered Hospital Networks,2020,American Economic Journal: Applied Economics,Elena Prager,https://doi.org/10.1257/app.20180422,crossref
10.1257/jel.20191450,"Using Synthetic Controls: Feasibility, Data Requirements, and Methodological Aspects",2021,Journal of Economic Literature,Alberto Abadie,https://doi.org/10.1257/jel.20191450,crossref
10.1257/jel.47.4.983,The Wealth of Cities: Agglomeration Economies and Spatial Equilibrium in the United States,2009,Journal of Economic Literature,Edward L. Glaeser; Joshua D. Gottlieb,https://doi.org/10.1257/jel.47.4.983,crossref
10.1257/jep.29.3.3,Why Are There Still So Many Jobs? The History and Future of Workplace Automation,2015,Journal of Economic Perspectives,David H. Autor,https://doi.org/10.1257/jep.29.3.3,crossref
10.1257/jep.34.2.90,Evaluating State and Local Business Incentives,2020,Journal of Economic Perspectives,Cailin Slattery; Owen Zidar,https://doi.org/10.1257/jep.34.2.90,crossref
10.1287/msom.2015.0536,Capacity Investment in Renewable Energy Technology with Supply Intermittency: Data Granularity Matters!,2015,Manufacturing &amp; Service Operations Management,Shanshan Hu; Gilvan C. Souza; Mark E. Ferguson; Wenbin Wang,https://doi.org/10.1287/msom.2015.0536,crossref
10.1371/journal.pone.0285497,Research on the risk transmission mechanism of international construction projects based on complex network,2023,PLOS ONE,Yanjun Huangfu; Jingrong Xu; Yang Zhang; Dechun Huang; Jiahui Chang,https://doi.org/10.1371/journal.pone.0285497,crossref
10.1557/s43581-022-00024-0,Comparing energy efficiency and price policy from a sustainable development perspective: Using fossil fuel demand elasticities in Iran,2022,MRS Energy &amp; Sustainability,Vahid Mohamad Taghvaee; Abbas Assari Arani; Susanne Soretz; Lotfali Agheli,https://doi.org/10.1557/s43581-022-00024-0,crossref
10.17848/9780880996532,Unemployment Insurance Reform: Fixing a Broken System,2018,,,https://doi.org/10.17848/9780880996532,crossref
10.17848/tr18-034,Who Benefits From Economic Development Incentives? How Incentive Effects on Local Incomes and the Income Distribution Vary with Different Assumptions about Incentive Policy and the Local Economy,2018,,Timothy J. Bartik,https://doi.org/10.17848/tr18-034,crossref
10.17848/wp18-289,"""But For"" Percentages for Economic Development Incentives: What Percentage Estimates are Plausible Based on the Research Literature?",2018,,Timothy J. Bartik,https://doi.org/10.17848/wp18-289,crossref
10.17848/wp20-326,Do Stronger Employment Discrimination Protections Decrease Reliance on Social Security Disability Insurance? Evidence from the U.S. Social Security Reforms,2020,,Patrick Button; Mashfiqur R. Khan,https://doi.org/10.17848/wp20-326,crossref
10.2139/ssrn.2921453,Bank Supervision and Syndicated Lending,2017,SSRN Electronic Journal,Ivan Ivanov; Benjamin Ranish; James Wang,https://doi.org/10.2139/ssrn.2921453,crossref
10.2139/ssrn.5178967,From Policy to Prosperity: Evaluating the Socio-Economic Impacts of Renewable Energy Technologies Under the UK Contracts for Difference (Cfd) Scheme,2025,,Vahid Ghorbani Pashakolaie; Matthew Cotton; Malte Jansen,https://doi.org/10.2139/ssrn.5178967,crossref
10.2200/s00193ed1v01y200905cac006,The Datacenter as a Computer,2019,Synthesis Lectures on Computer Architecture,Luiz André Barroso; Urs Hölzle; Parthasarathy Ranganathan,https://doi.org/10.1007/978-3-031-01761-2,crossref
10.2307/2232670,Booming Sector and De-Industrialisation in a Small Open Economy,1982,The Economic Journal,W. Max Corden; J. Peter Neary,https://doi.org/10.2307/2232670,crossref
10.3386/w32131,"Populism, Polarization and Green Investment",2024,,Anders Anderson; David Robinson,https://doi.org/10.3386/w32131,crossref
10.3386/w32487,The Simple Macroeconomics of AI,2024,,Daron Acemoglu,https://doi.org/10.3386/w32487,crossref
10.3390/challe6010117,On Global Electricity Usage of Communication Technology: Trends to 2030,2015,Challenges,Anders Andrae; Tomas Edler,https://doi.org/10.3390/challe6010117,crossref
10.3390/en10101470,Trends in Data Centre Energy Consumption under the European Code of Conduct for Data Centre Energy Efficiency,2017,Energies,Maria Avgerinou; Paolo Bertoldi; Luca Castellazzi,https://doi.org/10.3390/en10101470,crossref
10.3390/en5114569,Non-Intrusive Demand Monitoring and Load Identification for Energy Management Systems Based on Transient Feature Analyses,2012,Energies,Hsueh-Hsien Chang,https://doi.org/10.3390/en5114569,crossref
10.3390/ijerph18041559,Early Impacts of the COVID-19 Pandemic on the United States Construction Industry,2021,International Journal of Environmental Research and Public Health,Abdullah Alsharef; Siddharth Banerjee; S M Jamil Uddin; Alex Albert; Edward Jaselskis,https://doi.org/10.3390/ijerph18041559,crossref
10.3390/su10082884,"Ex-Ante Analysis of Economic, Social and Environmental Impacts of Large-Scale Renewable and Nuclear Energy Targets for Global Electricity Generation by 2030",2018,Sustainability,Kamel Almutairi; Greg Thoma; Alvaro Durand-Morat,https://doi.org/10.3390/su10082884,crossref
10.3390/su15065069,Impacts of Renewable Energy Generation on Greenhouse Gas Emissions in Saudi Arabia: A Comprehensive Review,2023,Sustainability,Fahad Saleh Al-Ismail; Md Shafiul Alam; Md Shafiullah; Md Ismail Hossain; Syed Masiur Rahman,https://doi.org/10.3390/su15065069,crossref
10.3982/ecta19815,"Tasks, Automation, and the Rise in U.S. Wage Inequality",2022,Econometrica,Daron Acemoglu; Pascual Restrepo,https://doi.org/10.3982/ecta19815,crossref
10.4159/9780674726123,The Fissured Workplace,2014,,David Weil,https://doi.org/10.4159/9780674726123,crossref
10.5547/01956574.33.2.3,Split Incentives in Residential Energy Consumption,2012,The Energy Journal,Kenneth Gillingham; Matthew Harding; David Rapson,https://doi.org/10.5547/01956574.33.2.3,crossref
